slug,title,content
china-to-usa-cat,Bring a Cat from China to the USA (2026 Guide),"<p>Importing a cat from China requires a 15-digit ISO microchip and a rabies certificate. You must also obtain an official exit health certificate from the local Customs Bureau (Hai Guan) within 14 days of your flight.</p>"
china-to-usa-dog,Bring a Dog from China to the USA (2026 Guide),"<p>Dogs from China are considered 'High-Risk' by the CDC. You must have a valid CDC Dog Import Permit or a CDC Vaccination Reservation. Ensure your dog is at least 6 months old before travel.</p>"
pet-travel-cost-usa,Cost to Bring a Pet to the USA (2026 Estimate),"<p>Expect to pay between $1,000 and $4,500. Costs include airline pet fees ($200-$400 in-cabin), cargo shipping ($1,500+), and vet fees for USDA-style endorsements.</p>"
japan-to-usa-cat,Bring a Cat from Japan to the USA,
japan-to-usa-dog,Bring a Dog from Japan to the USA,
korea-to-usa-cat,Bring a Cat from South Korea to the USA,
korea-to-usa-dog,Bring a Dog from South Korea to the USA,
singapore-to-usa-cat,Bring a Cat from Singapore to the USA,
singapore-to-usa-dog,Bring a Dog from Singapore to the USA,
australia-to-usa-cat,Bring a Cat from Australia to the USA,
australia-to-usa-dog,Bring a Dog from Australia to the USA,
canada-to-usa-cat,Bring a Cat from Canada to the USA,
canada-to-usa-dog,Bring a Dog from Canada to the USA,
uk-to-usa-cat,Bring a Cat from the UK to the USA,
uk-to-usa-dog,Bring a Dog from the UK to the USA,
eu-to-usa-cat,Bring a Cat from the EU to the USA,
eu-to-usa-dog,Bring a Dog from the EU to the USA,
mexico-to-usa-dog,Bring a Dog from Mexico to the USA,
brazil-to-usa-dog,Bring a Dog from Brazil to the USA,
india-to-usa-cat,Bring a Cat from India to the USA,
india-to-usa-dog,Bring a Dog from India to the USA,
philippines-to-usa-cat,Bring a Cat from the Philippines to the USA,
philippines-to-usa-dog,Bring a Dog from the Philippines to the USA,
thailand-to-usa-cat,Bring a Cat from Thailand to the USA,
thailand-to-usa-dog,Bring a Dog from Thailand to the USA,
vietnam-to-usa-cat,Bring a Cat from Vietnam to the USA,
vietnam-to-usa-dog,Bring a Dog from Vietnam to the USA,
malaysia-to-usa-cat,Bring a Cat from Malaysia to the USA,
malaysia-to-usa-dog,Bring a Dog from Malaysia to the USA,
taiwan-to-usa-cat,Bring a Cat from Taiwan to the USA,
taiwan-to-usa-dog,Bring a Dog from Taiwan to the USA,
hongkong-to-usa-cat,Bring a Cat from Hong Kong to the USA,
hongkong-to-usa-dog,Bring a Dog from Hong Kong to the USA,
usa-pet-import,USA Pet Import Requirements (Cats & Dogs),
cat-import-usa,Cat Import Requirements for the USA,
dog-import-usa,Dog Import Requirements for the USA,
cdc-dog-import-rules,CDC Dog Import Rules Explained,
cdc-dog-import-permit,Do You Need a CDC Dog Import Permit?,
dog-import-banned-countries,Dog Import Restrictions and High-Risk Countries,
rabies-vaccine-requirements,Rabies Vaccine Requirements for Pet Travel,
rabies-titer-test,Rabies Titer Test: When You Need It,
pet-microchip-requirements,Pet Microchip Requirements (ISO 11784/11785),
pet-health-certificate,Pet Health Certificate: What It Is and How to Get It,
usda-accredited-vet,USDA-Accredited Vet: When It Matters,
fit-to-fly-letter,Fit-to-Fly Letter for Pets: Airline Requirements,
pet-travel-crate,Airline Pet Crate Requirements (Size, Ventilation, Tips),
in-cabin-pet-rules,In-Cabin Pet Rules: Weight Limits and Booking Tips,
checked-baggage-pet,Checked Baggage Pet Travel: Pros, Cons, Rules,
cargo-pet-travel,Pet Travel as Cargo: What to Expect,
pet-travel-timeline,Pet Travel Timeline: 30/60/90-Day Checklist,
pet-quarantine-usa,Does the USA Quarantine Pets? What Actually Happens,
pet-customs-arrival,What Happens at US Customs When You Arrive with a Pet,
pet-vaccination-checklist,Pet Vaccination Checklist for International Travel,
pet-deworming,Do Pets Need Deworming for US Entry?,
pet-tapeworm-treatment,Tapeworm Treatment Rules for International Pet Travel,
pet-passport-usa,Do You Need a Pet Passport to Enter the USA?,
moving-to-usa-with-pets,Moving to the USA with Pets: Full Relocation Guide,
traveling-with-pets-internationally,International Pet Travel Guide: The Basics,
airline-pet-fees,Airline Pet Fees: Typical Price Ranges and Hidden Costs,
how-to-book-pet-flight,How to Book a Flight for Your Pet (Step-by-Step),
best-airlines-for-pets,Best Airlines for Traveling with Pets (What to Compare),
pet-carrier-in-cabin,Best In-Cabin Pet Carrier Size Guide,
pet-escape-proof-harness,Escape-Proof Harness Tips for Airport Travel,
airport-security-with-pets,Airport Security with Pets: TSA Process Explained,
pet-sedation-flight,Should You Sedate a Pet for Flying? Risks and Alternatives,
pet-motion-sickness,Pet Motion Sickness During Flights: Prevention Tips,
pet-hydration-flight,Keeping Your Pet Hydrated on Long Flights,
pet-feeding-before-flight,Feeding Schedule Before Flying with a Pet,
pet-anxiety-flight,How to Reduce Pet Anxiety When Flying,
pet-travel-documents-checklist,Pet Travel Documents Checklist (Printable),
lost-pet-airport,What to Do If a Pet Is Lost at the Airport,
pet-import-us-states,Do US States Have Different Pet Entry Rules?,
pet-arrival-lax,LAX Pet Arrival Guide (Los Angeles),
pet-arrival-sfo,SFO Pet Arrival Guide (San Francisco),
pet-arrival-jfk,JFK Pet Arrival Guide (New York),
pet-arrival-sea,SEA Pet Arrival Guide (Seattle),
pet-arrival-ord,ORD Pet Arrival Guide (Chicago),
pet-arrival-dfw,DFW Pet Arrival Guide (Dallas),
pet-arrival-mia,MIA Pet Arrival Guide (Miami),
pet-travel-insurance,Pet Travel Insurance: What It Covers,
pet-travel-agency,Should You Use a Pet Relocation Agency?,
pet-relocation-vs-diy,DIY vs Pet Relocation Service: Cost & Risk Comparison,
pet-import-mistakes,Top Pet Import Mistakes That Cause Delays,
pet-import-denied-entry,Why Pets Get Denied Entry and How to Avoid It,
pet-documents-translation,Do Pet Documents Need Translation for US Entry?,
pet-microchip-scan,How to Verify Your Pet Microchip Scans Correctly,
pet-vaccine-records,How to Keep Vaccine Records Acceptable for Airlines,
pet-health-check-before-flight,Pre-Flight Vet Check: What Vets Look For,
pet-travel-checklist-7-days,7 Days Before Flying with a Pet: Checklist,
pet-travel-checklist-24-hours,24 Hours Before Flying with a Pet: Checklist,
pet-travel-crate-training,Crate Training for Flight: 7-Day Plan,
pet-flight-delay,If Your Flight Is Delayed: Pet Safety Plan,
pet-layover-guide,Pet Travel with Layovers: What to Plan,
pet-import-faq,USA Pet Import FAQ (Quick Answers),
